title,description,rating,release_year,runtime,genres,languages,AKAs,tmdb_id
The Matrix,"A computer hacker learns from mysterious rebels about the true nature of his reality and his role in the war against its controllers.",8.7,1999,136,"Action, Sci-Fi","English",Matrix,603
Inception,"A thief who steals corporate secrets through the use of dream-sharing technology is given the inverse task of planting an idea into the mind of a C.E.O.",8.8,2010,148,"Action, Adventure, Sci-Fi","English, Japanese, French",Origin,137
The Shawshank Redemption,"Two imprisoned men bond over a number of years, finding solace and eventual redemption through acts of common decency.",9.3,1994,142,"Drama",English,Shawshank Redemption,278
Pulp Fiction,"The lives of two mob hitmen, a boxer, a gangster and his wife, and a pair of diner bandits intertwine in four tales of violence and redemption.",8.9,1994,154,"Crime, Drama","English, Spanish, French",Marsellus Wallace,680
The Dark Knight,"When the menace known as The Joker wreaks havoc and chaos on the people of Gotham, Batman must accept one of the greatest psychological and physical tests of his ability to fight injustice.",9.0,2008,152,"Action, Crime, Drama","English",Dark Knight,155
Forrest Gump,"The presidencies of Kennedy and Johnson, the Vietnam War, the Watergate scandal and other historical events unfold from the perspective of an Alabama man with an IQ of 75, whose only desire is to be reunited with his childhood sweetheart.",8.8,1994,142,"Drama, Romance","English",Gump,13
The Godfather,"The aging patriarch of an organized crime dynasty transfers control of his clandestine empire to his reluctant son.",9.2,1972,175,"Crime, Drama","English, Italian, Latin",Puzo's Mafia,238
